{"definition_sha256":"870f9cbec0d8d1e47152a8ec217f4370bbfa1e00f3b96b598a3251b198d04a13","end_timestamp":"2026-08-30T04:47:35.914886+00:00","evidence":[{"byte_count":0,"relative_path":"evidence/triton-ascend-num-warps-001.stdout.log","sha256":"e3b0c44298fc1c149afbf4c8996fb92427ae41e4649b934ca495991b7852b855"},{"byte_count":0,"relative_path":"evidence/triton-ascend-num-warps-001.stderr.log","sha256":"e3b0c44298fc1c149afbf4c8996fb92427ae41e4649b934ca495991b7852b855"},{"byte_count":693,"relative_path":"evidence/triton-ascend-num-warps-001.payload.json","sha256":"bc626b62ca8afe433fd80ee7840148e9c340bede76ebea402947af8a34ef5cdc"}],"implementation_profile_id":"triton_ascend","implementation_profile_path":"/workspace/kernelswift-dev-4ff2094/skills/kernel-opt-loop/profiles/triton_ascend/profile.yaml","implementation_profile_sha256":"5d93aaaede8feb59314e1dcc0a0474d2621b0a95ad59200cbf97ecc51b3a6bd0","implementation_profile_version":1,"inputs":{"inputs/payload/num_warps.py":{"byte_count":4425,"relative_path":"inputs/payload/num_warps.py","sha256":"8109aeebc6debbd4e41c4302b1e85726d40c103e4525f45e1b29586a8a0155d4"},"inputs/probe-definition.json":{"byte_count":1105,"relative_path":"inputs/probe-definition.json","sha256":"870f9cbec0d8d1e47152a8ec217f4370bbfa1e00f3b96b598a3251b198d04a13"},"inputs/profile.snapshot.yaml":{"byte_count":21232,"relative_path":"inputs/profile.snapshot.yaml","sha256":"5d93aaaede8feb59314e1dcc0a0474d2621b0a95ad59200cbf97ecc51b3a6bd0"},"inputs/qualification-requirement.json":{"byte_count":188,"relative_path":"inputs/qualification-requirement.json","sha256":"bcbd6542c3a36dacc16a02a348e7c59a2e7f0bba46d85a230edb94562026a05b"},"inputs/runtime-snapshot.json":{"byte_count":545,"relative_path":"inputs/runtime-snapshot.json","sha256":"6004296625865f2aea0ed6e72b1ff0e0d2b6122b9eff7567de3382d53dfb4ad1"}},"qualification_requirement_sha256":"bcbd6542c3a36dacc16a02a348e7c59a2e7f0bba46d85a230edb94562026a05b","requested_probe_ids":["triton-ascend-num-warps-001"],"results":[{"byte_count":2062,"relative_path":"results/triton-ascend-num-warps-001.json","sha256":"15ef0afe58f991e5fe9a57bff79cc2cedcb69737fe1769fb80a5765194e28834"}],"run_id":"nw-20260830","runtime_fingerprint":"6856c616ddb16544c3e913136c514742d94ab44f5e9072484bae73d680f08a6b","schema_version":1,"start_timestamp":"2026-08-30T04:47:20.414329+00:00","summary":"evidence-ready","target_id":"ascend910b"}
