{"definition_sha256":"9efc2c86c27a87714eb7529a267f3c1f01b644a2000139db1ef969022f0eca34","end_timestamp":"2026-08-30T04:48:50.431050+00:00","evidence":[{"byte_count":0,"relative_path":"evidence/triton-ascend-dot-tiles-001.stdout.log","sha256":"e3b0c44298fc1c149afbf4c8996fb92427ae41e4649b934ca495991b7852b855"},{"byte_count":0,"relative_path":"evidence/triton-ascend-dot-tiles-001.stderr.log","sha256":"e3b0c44298fc1c149afbf4c8996fb92427ae41e4649b934ca495991b7852b855"},{"byte_count":3881,"relative_path":"evidence/triton-ascend-dot-tiles-001.payload.json","sha256":"07d35d492d9e5d369ae895bac5101f9bfc9d20353b2ba0294cd8a9af3d192854"}],"implementation_profile_id":"triton_ascend","implementation_profile_path":"/workspace/kernelswift-dev-4ff2094/skills/kernel-opt-loop/profiles/triton_ascend/profile.yaml","implementation_profile_sha256":"5d93aaaede8feb59314e1dcc0a0474d2621b0a95ad59200cbf97ecc51b3a6bd0","implementation_profile_version":1,"inputs":{"inputs/payload/dot_tiles.py":{"byte_count":7180,"relative_path":"inputs/payload/dot_tiles.py","sha256":"fa10adc5d33e9c3509865bec0f93dbc155a8d5ea559c8db942bbf0234b4bf34b"},"inputs/probe-definition.json":{"byte_count":1211,"relative_path":"inputs/probe-definition.json","sha256":"9efc2c86c27a87714eb7529a267f3c1f01b644a2000139db1ef969022f0eca34"},"inputs/profile.snapshot.yaml":{"byte_count":21232,"relative_path":"inputs/profile.snapshot.yaml","sha256":"5d93aaaede8feb59314e1dcc0a0474d2621b0a95ad59200cbf97ecc51b3a6bd0"},"inputs/qualification-requirement.json":{"byte_count":401,"relative_path":"inputs/qualification-requirement.json","sha256":"bce75bcbd399678c34dfa4d78be3e83aebb95447c04f8239394c5626cd656a90"},"inputs/runtime-snapshot.json":{"byte_count":545,"relative_path":"inputs/runtime-snapshot.json","sha256":"6004296625865f2aea0ed6e72b1ff0e0d2b6122b9eff7567de3382d53dfb4ad1"}},"qualification_requirement_sha256":"bce75bcbd399678c34dfa4d78be3e83aebb95447c04f8239394c5626cd656a90","requested_probe_ids":["triton-ascend-dot-tiles-001"],"results":[{"byte_count":5025,"relative_path":"results/triton-ascend-dot-tiles-001.json","sha256":"c0670e9be7ec0641fef877f7ee627faeade0ce14aae6c922d82a2a097858f114"}],"run_id":"dot-fp16-20260830","runtime_fingerprint":"6856c616ddb16544c3e913136c514742d94ab44f5e9072484bae73d680f08a6b","schema_version":1,"start_timestamp":"2026-08-30T04:48:12.624768+00:00","summary":"evidence-ready","target_id":"ascend910b"}
