{"definition_sha256":"fc4baa5a8109d89c39e33192aa7e04ffb2cacb1737b461ef5b49c15b3b20684d","end_timestamp":"2026-08-30T04:48:01.799691+00:00","evidence":[{"byte_count":0,"relative_path":"evidence/triton-ascend-num-stages-001.stdout.log","sha256":"e3b0c44298fc1c149afbf4c8996fb92427ae41e4649b934ca495991b7852b855"},{"byte_count":0,"relative_path":"evidence/triton-ascend-num-stages-001.stderr.log","sha256":"e3b0c44298fc1c149afbf4c8996fb92427ae41e4649b934ca495991b7852b855"},{"byte_count":698,"relative_path":"evidence/triton-ascend-num-stages-001.payload.json","sha256":"2d9b43b05af2a91a413caf7671406213d750dd3749d5a91d9b039f151956285d"}],"implementation_profile_id":"triton_ascend","implementation_profile_path":"/workspace/kernelswift-dev-4ff2094/skills/kernel-opt-loop/profiles/triton_ascend/profile.yaml","implementation_profile_sha256":"5d93aaaede8feb59314e1dcc0a0474d2621b0a95ad59200cbf97ecc51b3a6bd0","implementation_profile_version":1,"inputs":{"inputs/payload/num_stages.py":{"byte_count":4677,"relative_path":"inputs/payload/num_stages.py","sha256":"5b76d53f64f289b2a5cb6bae24a348d9842a3cf20ffb67b2ce7163803399a1d6"},"inputs/probe-definition.json":{"byte_count":1104,"relative_path":"inputs/probe-definition.json","sha256":"fc4baa5a8109d89c39e33192aa7e04ffb2cacb1737b461ef5b49c15b3b20684d"},"inputs/profile.snapshot.yaml":{"byte_count":21232,"relative_path":"inputs/profile.snapshot.yaml","sha256":"5d93aaaede8feb59314e1dcc0a0474d2621b0a95ad59200cbf97ecc51b3a6bd0"},"inputs/qualification-requirement.json":{"byte_count":191,"relative_path":"inputs/qualification-requirement.json","sha256":"f19683a317f29be3f43b3d3ba04f3c5a70a3046bb20797a0858dd6570a8da655"},"inputs/runtime-snapshot.json":{"byte_count":545,"relative_path":"inputs/runtime-snapshot.json","sha256":"6004296625865f2aea0ed6e72b1ff0e0d2b6122b9eff7567de3382d53dfb4ad1"}},"qualification_requirement_sha256":"f19683a317f29be3f43b3d3ba04f3c5a70a3046bb20797a0858dd6570a8da655","requested_probe_ids":["triton-ascend-num-stages-001"],"results":[{"byte_count":2072,"relative_path":"results/triton-ascend-num-stages-001.json","sha256":"3c4b32f7cbeb86007057765c23d228841156b5a33eb65ae3d19b23a6b863591b"}],"run_id":"ns-20260830","runtime_fingerprint":"6856c616ddb16544c3e913136c514742d94ab44f5e9072484bae73d680f08a6b","schema_version":1,"start_timestamp":"2026-08-30T04:47:36.052586+00:00","summary":"evidence-ready","target_id":"ascend910b"}
